Country Code,Post,Comment,Date,Sentiment_Value,Sentiment
FRA,Le METRO BOULOT DODO a t'il ses limites ?,"Welcome to the mid-30s crisis, more and more of us are experiencing it. I did it at around the same age as you and I handled it in the worst possible way, so here's what I can offer you to avoid doing the same:

- Take a step back. Your job doesn't need to be your life or your identity. If you find a job and feel good enough to make it your life, you can, no judgment. But that’s clearly not your case today.

- Set limits. As long as your job isn't your life, it doesn't have to take up all your time either. Is there a culture of presenteeism where you live? Is it necessary to work a lot of hours to do the job, or do you have a little leeway when it comes to organizing your time? If it's the first case, you'll need to put strategies in place to regain some control over your schedule, because you'll need some for the future:

- Find something that gives you meaning, that makes you proud to be you. The way I say it most often is to find *something that comes naturally to you when you start the phrase “I am”*. You are not a finance employee. What are you ? You may be a singer, a dancer, a polyglot, an athlete, but you don't know it yet. You earn a good living, what is your salary for? Personally, I went through singing, percussion, the swimming pool, half a dozen modern languages, tai chi, yoga and dance before finding what made me tick. And it was with vibrancy that I came out of my mid-thirties crisis, but it took me a good five years to get there. You can do it faster.",2023-11-03 10:35:13,0.17728787878787877,Positive
FRA,Le METRO BOULOT DODO a t'il ses limites ?,"There are many, very many of us. Good luck.",2023-11-03 10:35:35,0.6166666666666666,Positive
FRA,Le METRO BOULOT DODO a t'il ses limites ?,"You can also do something else.
I have experience of late studies and positions similar to yours although in another field.
What I ended up understanding at one point was that having had the courage and the nerve (because you have to have a bit of courage to make the statistics lie) to return to studies late in life meant everything to me. even always allowed in the end to have more freedom.
So at one point I said to myself, either I become bitter at 33, or I push a little further.
In the end, at the same time as work, I took up a doctoral thesis.
3 years after the end of the thesis, I am considered a real ""expert"", so I only do the interesting part of the job as an external consultant and extremely well paid.
Money not being an end in itself, this above all allows me to work an average of half time, with a very decent income.",2023-11-03 11:11:34,0.005147058823529416,Positive
FRA,Le METRO BOULOT DODO a t'il ses limites ?,"Just curious, but what exactly are you doing in finance to have been recruited without speaking English?",2023-11-03 14:57:13,0.049999999999999996,Positive
FRA,Le METRO BOULOT DODO a t'il ses limites ?,">I'm in finance.
>
>Today, I was hired in a large European bank.
>
>So I went from the start-up to the very solemn atmosphere of a big company. I'm intellectually bored, the average age of the company is 50, they all seem bitter, the women push me aside, the men stare at me... I'm not comfortable.

Yes, you have a boring job, with long hours, difficult and with a shitty atmosphere

Your problem isn't the metro-work-sleep, it's that your job is horrible (and I suppose it doesn't leave you much free time). You have a nice CV: change!

By doing finance, you can work in any company. any sector, any size, any ambiance. Why join a giant bank full of boomers?",2023-11-03 18:08:04,-0.09910714285714287,Negative
FRA,Le METRO BOULOT DODO a t'il ses limites ?,"And why not start learning English to have more choices? After maybe 6 months - 1 year, you will find a more interesting job with the younger people.",2023-11-03 13:19:28,0.3,Positive
FRA,Le METRO BOULOT DODO a t'il ses limites ?,"I'll keep it short, but given your background and status, I suppose you have the means to save money.
And once you have some €10 or €20k saved, you can easily go and experience the adventure that you seem to both really want and need.

Take a year off, go with your backpack, live the life you dream of, travel. And take advantage of this distance to, when the time comes, question yourself about what you want from life, what brings you fulfillment. You only have one life, don't waste it.",2023-11-03 11:11:01,0.09494949494949494,Positive
FRA,Le METRO BOULOT DODO a t'il ses limites ?,">I'm in finance.

You're looking for trouble too. It’s such a rotten environment.

If you want to flourish, you have to change your environment",2023-11-03 13:36:33,-0.1,Negative
FRA,Le METRO BOULOT DODO a t'il ses limites ?,[gif of the guy wiping his tears with biftons],2023-11-03 10:37:08,0.0,Neutral
FRA,Le METRO BOULOT DODO a t'il ses limites ?,"You can use your free time to explore new horizons. I am thinking particularly of associations/volunteering. You can also stick your nose into local political decisions in your city.

And if you find something you're passionate about, you can find out about the possibility of going 80% on your job.

Having a ""tolerable"" job is enough if you have something more interesting than your job in your life.",2023-11-03 10:41:01,0.18367003367003365,Positive
FRA,Le METRO BOULOT DODO a t'il ses limites ?,"I'm 26 years old and I work abroad in a big company. I am by far the youngest of my colleagues and we have 15% women. I earn a good living and the job is quite nice, but I don't really have a connection with my colleagues who are much older than me and are men with families and children. At my previous job I also experienced a lot of condescension and sexism because of my young age and gender. It doesn't help that I don't speak the local language very well (they all speak English fluently, but of course speak Danish among themselves) even though I study it.


This is how I see things: I plan to stay for the next 4 years because that is when I will leave the salary increase level. I tell myself that around the age of 30 I will analyze what I want to do and where I want to go. Until then, I will try to earn a good living and put as much aside as possible for a possible new start (moving to another country, it will also depend on if I meet someone with whom to share my life). Giving myself goals and a “deadline” helps me not to be impatient, because I also want to move too. I know I won't be satisfied with this life but right now I need it. I like to cultivate my dreams and desires in my head. Moving here was part of it.


I hope this helps you! Good luck, you don't have to go to work to sleep if you have the opportunity to do what you want :)


Edit: try to learn English if you can. Even if you're not bilingual, it's a good starting point to get away from it all. And it's an essential tool if you want to leave France one day!",2023-11-03 10:51:02,0.2283395176252319,Positive
FRA,Le METRO BOULOT DODO a t'il ses limites ?,"Maybe move towards fintech where people are younger?

My company (3000 people) is recruiting quite a bit but you have to speak English at least at a fairly OK level and have good working conditions.

For metro printing, it's hard to say if another job would solve that. On the other hand, for the bitter colleagues side, you can clearly find better elsewhere",2023-11-03 12:08:22,0.09833333333333331,Positive
FRA,Le METRO BOULOT DODO a t'il ses limites ?,Come work in aeronautics.,2023-11-03 12:25:43,0.0,Neutral
FRA,Le METRO BOULOT DODO a t'il ses limites ?,"Reduce working time, think of others, ...",2023-11-03 12:40:00,0.0,Neutral
FRA,Le METRO BOULOT DODO a t'il ses limites ?,"Hi !
Your post and the comments are rather pleasant to me because I am in the middle of it.
You study, you work, you give your all, you climb the ladder and... at 30 you are at the end of your rope, without fulfillment.
I am currently unemployed, fortunately I know what makes me tick (the perverse side in my case is that it was also my job.)


It's important to take care of yourself, and especially to have seen it coming. As pointed out in other comments, there are too many people who find themselves retired and who have completely missed out on their lives :'(",2023-11-03 13:49:39,0.10083333333333333,Positive
FRA,Metro Paris,"The Citymapper app is even better than Google Maps in Paris (both for streets and for transport). https://play.google.com/store/apps/details?id=com.citymapper.app.release
As for prices, I'll let others answer you: I haven't been in Paris for a few years. But it all depends on how much time you're going to spend there.",2023-05-19 06:21:49,0.16666666666666666,Positive
FRA,Metro Paris,">how to find your way when taking the metro/rer

All lines have a number, which is written in a colored circle specific to each line (yellow for line 1, purple for 14, etc.). When you arrive at a station and need to make a connection, all you have to do is follow the signs. Except in Châtelet, it is rarely complicated.
Important: when looking for your way and slowing down/stopping, you should not do so at the top of the escalators or in the path, but move away from the flow of people/

>Is there an app to know which metro to take to get to our destination?

Citymapper, Vianavigo, the RATP app, IDF mobility...

>And the Navigo pass, I still don’t understand how it works

I really don't see how it's complicated: you subscribe (by the day, by the week, by the month or by the year) and it allows you to take any means of RATP/SNCF transport throughout the 'Ile-de-France. Small trap: stations at the ends of lines outside Ile de France (like the RER D from the white terminal in the north/Malsherbe in the south) are not included.

>I have a great fear of getting lost when taking the metro in Paris

Be careful, the method that I am going to reveal to you is a secret that has been passed down orally for decades between initiated people: if you are lost, you approach a person (ideally [those in a gray suit with a green striped tie/scarf and blue and sporting an RATP badge](https://www.upromi.com/upromi/wp-content/uploads/2018/09/ARC_RATP-2.png), but it works with any person).You plant your gaze in that of the chosen person and then be careful, everything gets carried away, you have to be reactive:

* You start with a greeting, a “hello” will do just fine at any time
* The machine is started, you only have a few moments while the person responds to your politeness to bounce back: “excuse me, I got lost, could you tell me how to get back to X”

Normally you have your answer but BE CAREFUL it's not over, the misstep is still possible, it would be a shame to come across as an asshole so close to the goal. It is indeed necessary to conclude with a new mark of politeness such as “Thank you and have a good day”.

Well I know, it seems simple because I've been practicing for years, my advice is to train with loved ones a few weeks before departure.


Last thing: the metro is certainly the quickest way, but the underground is not necessarily the best view of Paris. If you can, try to stay on the surface by taking the bus or a self-service bike!",2023-05-19 06:26:48,0.08846738057264374,Positive
FRA,Metro Paris,"First you need to learn how to read a map and signs. The problem does not seem to be Paris, but rather understanding a map and the signs.

To make an itinerary you need to determine:

\- what is the closest station to your departure point

\- what is the closest station to your destination

\- which line(s) allows you to travel between these 2 stations.

Once you know which line to take, you need to check the direction.

But basically, Google Maps already does it for you. If you can't use Google Maps, you can practice where you are and try to see if you can follow a route on foot.

The difference between this and a metro ride is that Google Maps will tell you which line to take and in which direction. The direction is indicated on the signs in the station and on the platform. The exits are numbered (number or letter) and Google Maps will also tell you which exit to take once you arrive at your destination.

But it's like that everywhere in the world, not just in Paris.",2023-05-19 06:22:02,0.25,Positive
FRA,Metro Paris,"In Paris, the metro is almost always organized like this: a certain number of surface entrances which generally communicate with each other at the information and ticket processing point. There may be some which are reserved for the exit or which do not lead to exactly the same place but in any case, a station = a name = access to all the lines served regardless of the entrance.

So the first step is to know the names of the stations that you will use most often, that's good, they serve as a point of reference for everyone, much more than the names of the streets. You will very often hear “it’s in Nation” “I’m going to Havre-Caumartin” etc.

Then you need to join your line. They are numbered and colored and the direction in the corridors is indicated at each intersection in 99% of cases, so you just have to follow the route, it is only in very very large interconnected stations like Châtelet or Saint Lazare that this can be a little difficult to find your way around, but you end up learning the routes by heart.

Generally, the route to join the line splits in two to serve the platforms, because there is rarely a common platform, one platform = one direction. At the entrance to the platform there is always a sign indicating the stops served, so if your stop does not appear it is probably the wrong direction. It's organized like this:

One line = one color and one number + two terminals.
You have to learn to find your way around the terminus, for example line 1 in yellow, serves La Défense and Château de Vincennes. You must therefore know, in relation to where you are, if your stop is towards Château de Vincennes or La Défense and follow the corresponding signs.

Here again we use the maps and apps at the beginning, but very quickly we remember the direction of the terminus. Line 1 goes from east to west, so for me who lives far to the east, La Défense is the direction of the outward journey and Château de Vincennes on the return route.

Sometimes we have to make a connection, it's the same logic: we identify with an app or the map at which station the two lines intersect and once on the platform of the station where we have to change lines we locate the numbered colored sign and we follow the route in the direction of the terminus that interests us.

Once arrived, the best thing is to know which exit is closest to us and the applications are very practical for that, otherwise there are pedestrian maps of the area and exits on the platform.

As an application I recommend CityMapper which will divide the route into simple steps to follow",2023-05-19 06:44:25,0.12973710317460319,Positive
FRA,Metro Paris,RATP.Fr works very well (or the application). And even tells you where to get out and stand on the metro to optimize your route (front or back of the train),2023-05-19 06:19:30,0.1,Positive
FRA,Metro Paris,"You can also use metro “circle maps”. Very practical when discovering a city's metro network
[Paris metro circular map](https://metromap.fr/fr)",2023-05-19 07:56:11,0.2,Positive
FRA,Metro Paris,"I find that the RATP application is not too bad.
Afterwards you just have to make no mistake about the meaning.
Try to pay attention to the direction of the metro and even more so the RER.",2023-05-19 07:22:59,-0.09999999999999992,Negative
FRA,Metro Paris,"I had the same apprehensions at the beginning. And honestly, the RATP app was very, very useful.",2023-05-19 07:43:08,0.33,Positive
FRA,Metro Paris,"Thanks to everyone who took the time to help me. I really appreciate your advice and your very detailed explanations. It helps me enormously.
You are the best! ❤️",2023-05-19 19:37:03,0.384,Positive
FRA,Metro Paris,"Hi. You have the Bonjour RATP app which allows you to enter your starting point and your destination, and which shows you all the possible routes, from the fastest to the slowest.
Bonus, if you have a compatible Android phone, you can get your tickets directly from it. The Navigo pass is not necessarily the most interesting depending on where you live and the time you spend in Paris. On this subject, be careful with the RER (designated by letters and not numbers) which go further and which have different prices depending on the final destination (There are 5 different pricing zones): In Paris it is the same price as the metro, but if you go to Versailles for example, it will be more expensive. Same thing for Orly and Roissy airports. The Navigo pass has different options depending on the area chosen.",2023-05-19 06:24:30,0.05387205387205388,Positive
FRA,Metro Paris,"Gmaps can be used to have an overview of the possibilities offered, and see between the different types of transport, by bike or on foot. But when it comes to public transport primarily, everyone uses either the RATP or citymapper application (a habit from a time when it was one step ahead).",2023-05-19 07:53:05,0.13333333333333333,Positive
FRA,Metro Paris,"I found a video not too long ago that explained quite well how the metro works in Paris: https://youtu.be/NUMx6taaOws

For prices and the Navigo pass, it really depends on your use. The best idea would surely be to go to a counter (in the metros) and ask which would be most suitable.",2023-05-19 09:39:06,0.45,Positive
FRA,Metro Paris,"The “Île-de-France Mobilités” (IDF Mobilités) app is very good. To avoid getting lost, just search for ""Paris metro map pdf"" and that's it. Except at the Halles de Châtelet you should always find yourself.

Once out of the metro you have to use Google Maps, like everywhere else.",2023-05-20 07:53:58,0.9099999999999999,Positive
FRA,Metro Paris,"+1 for citymapper.

Be careful of one thing, the citymapper or Google maps apps do not have access to live timetables. The times they display are theoretical times. If you want the timetables in real time they are only available on the ratp (website or “hello ratp” app). But if Google maps is already complicated for op we will probably wait before getting to that...",2023-05-19 06:45:07,0.01948051948051948,Positive
FRA,Metro Paris,"> I really don't see how it's complicated

The fact of the weekly subscription which is not slippery is still really twisted.",2023-05-19 11:46:53,-0.26666666666666666,Negative
FRA,Ballerina in the Parisian metro #saaggo #saulaguilar,"It always fascinates me to think that these trains have been in service since 1967 if I have the wrong model. I find them quite pleasant in the end, in any case they have charm. The 77 models like on line 8 or the first models with connected trains like on line 4 and 14 damn what I don't like them though. They're making me feel bad.",2018-12-24 10:14:26,-0.05416666666666664,Negative
FRA,Ballerina in the Parisian metro #saaggo #saulaguilar,She's going to miss her subway if she doesn't hurry up. Had to jump in the other direction to land on the train,2018-12-24 10:06:37,-0.125,Negative
FRA,Ballerina in the Parisian metro #saaggo #saulaguilar,A completely ordinary scene from the Paris metro.,2018-12-24 13:34:49,-0.25,Negative
FRA,Ballerina in the Parisian metro #saaggo #saulaguilar,"Photo : Saul Aguilar :

[https://www.instagram.com/p/Blqm\_xvBbdM/](https://www.instagram.com/p/Blqm_xvBbdM/)",2018-12-24 14:38:30,0.0,Neutral
FRA,Ballerina in the Parisian metro #saaggo #saulaguilar,It's too clean. Are we sure it's the Paris metro?,2018-12-24 10:29:41,0.43333333333333335,Positive
FRA,Ballerina in the Parisian metro #saaggo #saulaguilar,It must be handy to be able to levitate like that.,2018-12-24 14:49:23,0.55,Positive
FRA,Ballerina in the Parisian metro #saaggo #saulaguilar,I can't imagine what a pleasant journey she must have had with short shorts like that...,2018-12-24 19:57:08,0.36666666666666664,Positive
FRA,Ballerina in the Parisian metro #saaggo #saulaguilar,I have the strangest shape at the moment.,2018-12-24 12:02:23,0.0,Neutral
FRA,Ballerina in the Parisian metro #saaggo #saulaguilar,"I have to leave, my planet needs me.",2018-12-24 16:58:30,0.0,Neutral
FRA,Ballerina in the Parisian metro #saaggo #saulaguilar,Amazing photo,2018-12-24 13:41:29,0.6000000000000001,Positive
FRA,Ballerina in the Parisian metro #saaggo #saulaguilar,"J'ai lu ""Benalla in the Parisian metro"".",2018-12-24 22:29:18,0.0,Neutral
FRA,Ballerina in the Parisian metro #saaggo #saulaguilar,Well done to her for putting up with the smell ^^,2018-12-24 12:07:36,0.0,Neutral
FRA,Ballerina in the Parisian metro #saaggo #saulaguilar,And then they'll complain about street harassment...,2018-12-26 12:50:49,0.0,Neutral
FRA,Ballerina in the Parisian metro #saaggo #saulaguilar,I fuck her without worries,2018-12-24 15:31:47,-0.4,Negative
FRA,Ballerina in the Parisian metro #saaggo #saulaguilar,"Aesthetically, they have their charm. On the other hand, the interior layout is an unspeakable horror in terms of comfort and use of space.",2018-12-24 11:54:43,-0.125,Negative
FRA,"Cette abomination vue dans le metro de Londres, je me suis senti insulté personnellement","If you want to see wine sabotaged, just watch people put ice cubes and syrup in it.
We already have that in France.",2021-10-09 08:34:53,0.0,Neutral
FRA,"Cette abomination vue dans le metro de Londres, je me suis senti insulté personnellement","What is the problem ? If the wine is good and it is not made to age, it is an excellent means of preservation, and it is undoubtedly very practical for having individual quantities in the fridge for an evening or for not having to open a large bottle.",2021-10-09 08:58:01,0.3523809523809524,Positive
FRA,"Cette abomination vue dans le metro de Londres, je me suis senti insulté personnellement",My god what a horror,2021-10-09 11:06:19,0.0,Neutral
FRA,"Cette abomination vue dans le metro de Londres, je me suis senti insulté personnellement","The can is a means of preservation like any other.

This is very suitable for wines that age very poorly, such as rosés, organic wines (or worse: biodynamic wines, which become undrinkable very quickly after opening, sometimes less than an hour).

Incidentally, this allows them to be exported without special precautions, in normal containers. Whereas in bottles, you need a refrigerated container (expensive financially, energetically and environmentally).

​

I find it a good way to continue exporting while reducing climate impact.",2021-10-09 11:55:24,0.1058008658008658,Positive
FRA,"Cette abomination vue dans le metro de Londres, je me suis senti insulté personnellement",What is the insult?,2021-10-09 09:15:15,0.0,Neutral
FRA,"Cette abomination vue dans le metro de Londres, je me suis senti insulté personnellement","I saw them at Carrefour, in the salad and canned sandwich aisle, between the cans of Coke and Monster. It was expensive.",2021-10-09 09:06:19,-0.5,Negative
FRA,"Cette abomination vue dans le metro de Londres, je me suis senti insulté personnellement",A case of war!,2021-10-09 14:18:18,0.0,Neutral
FRA,"Cette abomination vue dans le metro de Londres, je me suis senti insulté personnellement",Isn't it enough for the roast beef to steal our submarines? Do they have to dirty everything?,2021-10-09 08:25:32,-0.3,Negative
FRA,"Cette abomination vue dans le metro de Londres, je me suis senti insulté personnellement","In Poland they have 3 wines (yes 3 wines, not 3 types of wine): red, white and rosé. And all 3 are disgusting.

Well, in fact, compared to the English, the Poles are very connoisseurs.",2021-10-09 10:44:28,-0.16,Negative
FRA,"Cette abomination vue dans le metro de Londres, je me suis senti insulté personnellement","If it’s war they want, they’re going to get it!!!",2021-10-09 13:59:34,0.0,Neutral
FRA,"Cette abomination vue dans le metro de Londres, je me suis senti insulté personnellement",I'm ~~winning~~ winning right now.,2021-10-09 08:09:19,0.42857142857142855,Positive
FRA,"Cette abomination vue dans le metro de Londres, je me suis senti insulté personnellement",It's starting to happen for water too (Liquid Death). After all why not ?,2021-10-09 09:21:03,0.0,Neutral
FRA,"Cette abomination vue dans le metro de Londres, je me suis senti insulté personnellement","In the Gers, the English who lived there often asked me for a tariquet / Perrier.",2021-10-09 19:58:44,0.0,Neutral
FRA,"Cette abomination vue dans le metro de Londres, je me suis senti insulté personnellement","This coincidence. Yesterday I had a picnic with friends and there were cans of rosé. I told myself that I should have taken a photo to cause outrage on r/France.

He was very good.",2021-10-09 23:10:37,0.9099999999999999,Positive
FRA,"Cette abomination vue dans le metro de Londres, je me suis senti insulté personnellement",you syrup? :island,2021-10-09 09:03:17,0.0,Neutral
FRA,Strapontins du metro de Paris,"Tu ne trouves pas la réponse à ta question ici ? Tu la trouveras peut-être sur r/askfrance

Not finding the answer you're looking for ? You might find it on r/askfrance


*I am a bot, and this action was performed automatically. Please [contact the moderators of this subreddit](/message/compose/?to=/r/france) if you have any questions or concerns.*",2023-03-13 08:20:23,0.1,Positive
FRA,Strapontins du metro de Paris,"I imagined a rant about the people who stay seated on the folding seats even when there are people or about those who lean back with their big bags and give big blows to those sitting behind.

I could have finally assumed my Parisian DNA and moaned about all these assholes too!!",2023-03-13 09:00:59,-0.08,Negative
